{"protocolVersion":"0.1","request":{"id":"CONF-07"},"requester":{"name":"Conformance Support"},"purpose":{"code":"oversized","description":"Oversized output vector"},"capabilities":{"application.logs":{"requirement":"optional"},"system.os":{"requirement":"optional"}},"policy":{"networkAccess":false,"arbitraryShellExecution":false,"maximumTotalBytes":64},"local":{"applicationLogPath":"logs/big.log"}}